{
  "$schema": "https://json-schema.org/draft/2020-12/schema",
  "$id": "https://fortisland.local/contracts/publishing/market_proof_overview.v1.schema.json",
  "title": "market_proof_overview v1",
  "type": "object",
  "additionalProperties": false,
  "required": [
    "contract_name",
    "contract_version",
    "owner",
    "refresh_cadence",
    "source_layers",
    "grain",
    "date_range",
    "market",
    "records"
  ],
  "properties": {
    "contract_name": {
      "const": "market_proof_overview"
    },
    "contract_version": {
      "const": "v1"
    },
    "owner": {
      "type": "string",
      "minLength": 1
    },
    "refresh_cadence": {
      "const": "weekly"
    },
    "grain": {
      "const": "market_time_window"
    },
    "source_layers": {
      "type": "array",
      "minItems": 1,
      "items": {
        "type": "string",
        "enum": [
          "canonical_property_layer",
          "event_layer",
          "derived_commercial_layer"
        ]
      }
    },
    "date_range": {
      "type": "object",
      "additionalProperties": false,
      "required": [
        "start_date",
        "end_date"
      ],
      "properties": {
        "start_date": {
          "type": "string",
          "format": "date"
        },
        "end_date": {
          "type": "string",
          "format": "date"
        }
      }
    },
    "market": {
      "type": "object",
      "additionalProperties": false,
      "required": [
        "slug",
        "name"
      ],
      "properties": {
        "slug": {
          "type": "string"
        },
        "name": {
          "type": "string"
        }
      }
    },
    "records": {
      "type": "array",
      "minItems": 1,
      "items": {
        "type": "object",
        "additionalProperties": false,
        "required": [
          "market_slug",
          "period_start",
          "period_end",
          "new_sale_events",
          "late_sale_events",
          "scored_properties_count",
          "high_band_candidate_count",
          "high_band_candidate_rate",
          "model_version"
        ],
        "properties": {
          "market_slug": {
            "type": "string"
          },
          "period_start": {
            "type": "string",
            "format": "date"
          },
          "period_end": {
            "type": "string",
            "format": "date"
          },
          "new_sale_events": {
            "type": "integer",
            "minimum": 0
          },
          "late_sale_events": {
            "type": "integer",
            "minimum": 0
          },
          "scored_properties_count": {
            "type": "integer",
            "minimum": 0
          },
          "high_band_candidate_count": {
            "type": "integer",
            "minimum": 0
          },
          "high_band_candidate_rate": {
            "type": "number",
            "minimum": 0,
            "maximum": 1
          },
          "model_version": {
            "type": "string",
            "pattern": "^v[0-9]+$"
          }
        }
      }
    }
  }
}
